<?xml version="1.0" enconding="UTF-8"?>

<xs:schema xmlns:xsd="http://www.w3.org/2001/XMLSchema">

 <xs:element name="productos">
        <xs:complexType>
            <xs:sequence>
                <xs:element name="producto" maxOccurs="unbounded">
                    <xs:complexType>
                        <xs:sequence>
                            <xs:element name="imagen" type="xs:string"/>
                            <xs:element name="nombre" type="xs:string"/>
                            <xs:element name="cantidad" type="xs:integer"/>
                        </xs:sequence>
                    </xs:complexType>
                </xs:element>
            </xs:sequence>
        </xs:complexType>
    </xs:element>

</xs:schema>